<?xml version="1.0" encoding="UTF-8" ?>
<PersonList xmlns:xsi="http://www.w3.org/2001/XMLSchema-instance"
            xsi:noNamespaceSchemaLocation="PersonList.xsd">
    <Person>
        <Name>
            <FirstName>JAN</FirstName>
            <LastName>SMITHS</LastName>
        </Name>
        <Function>TRAINING CONSULT</Function>
        <Company>
            <CompanyName>ABIS Training &amp; Consulting</CompanyName>
            <CompanyAddress>LEUVEN</CompanyAddress>
        </Company>
    </Person>
    <Person>
        <Name>
            <FirstName>
                Gert
            </FirstName>
            <LastName>Van Heijkoop</LastName>
        </Name>
    </Person>
    <Person>
        <Name>
            <FirstName>PETER</FirstName>
            <LastName>TAVERNIER</LastName>
        </Name>
        <Function>PROGRAMMER</Function>
        <Company>
            <CompanyName>ABIS N.V.</CompanyName>
            <CompanyAddress>LEUVEN</CompanyAddress>
        </Company>
    </Person>
    <Person>
        <Name>

            <FirstName>Philip</FirstName>
            <LastName>Benoit</LastName>
        </Name>
        <Function>tester</Function>
    </Person>
</PersonList>